{
  "kind": "continuity_deletion_receipt",
  "deposit_id": "qdep_45a19c2e",
  "state": "deleted",
  "content_deleted_at": "2026-06-20T00:10:00.000Z",
  "content_hash": "sha256:299405503880d924e81fafbf0b0afa3aa72cd75de5b16e87d2dcedd5d99b76d0",
  "projection_retained": false,
  "tombstone_retained": true
}
